{
  "schemaVersion": "1.0",
  "providerId": "fixture-openai",
  "adapterVersion": "1.0.0",
  "requestedModel": "recorded-openai-shape",
  "servedModel": "recorded-openai-shape",
  "discoveredAt": "2026-08-31T00:00:00Z",
  "contextWindowTokens": 200000,
  "maxOutputTokens": 100000,
  "streaming": false,
  "strictStructuredOutput": true,
  "parallelToolCalls": false,
  "promptCaching": false,
  "opaqueReasoningHandles": false,
  "sessionResume": false,
  "sessionFork": false,
  "batch": false,
  "unsupportedCapabilities": ["live_calls", "streaming", "parallel_tool_calls", "prompt_caching", "reasoning_handles", "session_resume", "session_fork", "batch"]
}
